{
  "index_version": "1.0.0",
  "scope": {
    "brand_id": "brand_law_001",
    "account_ids": ["naver_001", "google_001"]
  },
  "column_aliases": {
    "account_id": ["계정 ID", "계정", "account_id"],
    "brand_id": ["브랜드 ID", "브랜드", "brand_id"],
    "campaign_type": ["캠페인 유형", "매체", "광고상품", "channel"],
    "campaign_name": ["캠페인", "캠페인명", "campaign"],
    "group_name": ["그룹", "광고그룹", "광고 그룹명", "ad_group", "adset"],
    "keyword_name": ["키워드", "키워드명", "keyword"],
    "url": ["URL", "랜딩URL", "최종 URL", "landing_url", "final_url"],
    "creative_name": ["소재명", "creative_name"],
    "ad_text": ["광고 문구", "ad_text"]
  },
  "forced_url_mapping": [
    {
      "id": "forced-criminal-001",
      "url": "https://example.com/criminal",
      "category": "형사",
      "include_query": false,
      "memo": "강제 분류 랜딩"
    },
    {
      "id": "forced-drug-001",
      "url": "https://example.com/drug",
      "category": "마약",
      "include_query": false
    }
  ],
  "campaign_type_rules": [
    {
      "id": "type-search-001",
      "field": "campaign_type",
      "match_type": "contains",
      "patterns": ["검색광고", "Naver SA", "Google Search"],
      "category": "검색광고",
      "confidence": 0.7,
      "enabled": true
    }
  ],
  "group_name_rules": [
    {
      "id": "group-criminal-001",
      "field": "group_name",
      "match_type": "contains",
      "patterns": ["형사", "구속", "고소"],
      "category": "형사",
      "confidence": 0.9,
      "campaign_type_filter": ["검색광고", "Naver SA", "Google Search"],
      "enabled": true
    },
    {
      "id": "group-divorce-001",
      "field": "group_name",
      "match_type": "contains",
      "patterns": ["이혼", "상간", "양육권"],
      "category": "이혼",
      "confidence": 0.9,
      "enabled": true
    }
  ],
  "keyword_rules": [
    {
      "id": "keyword-drug-001",
      "field": "keyword_name",
      "match_type": "contains",
      "patterns": ["마약", "대마", "필로폰"],
      "category": "마약",
      "confidence": 0.92,
      "campaign_type_filter": ["검색광고", "Naver SA", "Google Search"],
      "enabled": true
    }
  ],
  "campaign_name_rules": [
    {
      "id": "campaign-tax-001",
      "field": "campaign_name",
      "match_type": "contains",
      "patterns": ["조세", "세금"],
      "category": "조세",
      "confidence": 0.75,
      "enabled": true
    }
  ],
  "url_rules": [
    {
      "id": "url-criminal-001",
      "field": "url",
      "match_type": "contains",
      "patterns": ["/criminal/"],
      "category": "형사",
      "confidence": 0.65,
      "enabled": true
    },
    {
      "id": "url-divorce-001",
      "field": "url",
      "match_type": "contains",
      "patterns": ["/divorce/"],
      "category": "이혼",
      "confidence": 0.65,
      "enabled": true
    }
  ],
  "user_corrections": [
    {
      "id": "correction-20260625-001",
      "category": "형사",
      "evidence": {
        "campaign_type": "Naver SA",
        "group_name": "형사_구속",
        "keyword_name": "형사변호사",
        "campaign_name": "검색_형사",
        "url": "https://example.com/criminal"
      },
      "created_at": "2026-06-25T00:00:00+09:00"
    }
  ],
  "ai_fallback": {
    "enabled": true,
    "min_confidence": 0.7,
    "analyze_fields": [
      "landing_page_text",
      "creative_name",
      "ad_text",
      "page_title",
      "meta_description"
    ]
  }
}
